altid,title,content
sc4216189caf,Bath faced with Tindall ultimatum," Mike Tindall's agent has warned Bath they have until next week to improve their contract offer to the England man or risk losing him to a rival club.  Dipo Alli says he has received an offer for Tindall which dwarfs Bath's deal and that two other clubs want to talk. ""Mike does not want to go into the Six Nations worrying about where he will be playing his club rugby next season,"" Alli told the Guardian newspaper. ""It is up to (Bath owner) Andrew Brownsword. He has to make it happen."" Tindall is out of contract at the end of the season but it is understood that Brownsword is unwilling to break the club's salary structure to accommodate the 26-year-old's demands. But Alli insists the player is worth more than Bath have put on the table. ""Mike has been at Bath for eight years and wants to remain with the club and his demands are anything but excessive,"" the agent added. ""But Brownsword has to recognise Mike's value and we want to resolve things by the end of next week."""
sc35f054c50a,Paris promise raises Welsh hopes," Has there been a better Six Nations match than Saturday's epic in Paris?  And can the Welsh revival continue all the way to a first Grand Slam since 1978? Those are the two questions occupying not just Wales supporters but rugby fans as a whole after a scintillating display in Paris. Welsh legend Mervyn Davies, a member of two of three Grand Slam-winning sides of the 1970s, hailed it as ""one of the great performances of the past three decades"". Martyn Williams, Wales' two-try scorer on the day, called it ""one of the most surreal games I have ever played in"". A crestfallen France coach, Bernard Laporte, simply observed: ""There was a French half and there was a Welsh half"". And what a half it was for the Red Dragonhood, transforming a 15-6 half-time deficit into an 18-15 lead within five mesmerising minutes of the second period. But while that passage of play showed the swelling self-belief of a side prepared to back its own spirit of adventure, the final quarter told us a whole lot more about this Welsh side. That they recovered from a battering in the first half-hour to first stem the tide before half-time, then reverse it on the resumption, was remarkable enough. But in resisting a seemingly unstoppable wave of French pressure in a nail-biting final five minutes, Wales showed not only their physical attributes but their mental resolve.  In international rugby, any of the top seven sides can beat each other on a given day, but the great sides are those that win the close contests on a consistent basis. England suffered some infamous Six Nations disappointments en route to World Cup glory, the pain of defeat forging bonds that ultimately led to victory when it really mattered. Wales have some way to go before they can be remotely considered in a similar light. But the signs are that players previously on the receiving end are learning how to emerge on the right side of the scoreline. Ten of the 22 on duty on Saturday were also involved when Wales were trounced 33-5 in Paris two years ago. But since they threw off the shackles against New Zealand in the 2003 World Cup, Wales have rediscovered much of what made them a great rugby nation in the first place.  ""The confidence in the squad has been building and building since the World Cup and we now have young players who are becoming world class,"" noted coach Mike Ruddock. The likes of Michael Owen, Gethin Jenkins, Dwayne Peel and Gavin Henson are certainly building strong cases for inclusion on this summer's Lions tour to New Zealand. And players like Stephen Jones, Martyn Williams, Shane Williams and Gareth Thomas are proving it is not only the youngsters that are on an upward curve. Jones, after his superb man-of-the-match display, observed that ""we are a very happy camp now"". Ruddock and Thomas can take much of the credit for that, ensuring the tribal and regional divisions that have often scarred Welsh rugby do not extend to the national squad. The  joie de vivre  so evident in that magical second-half spell in Paris also stems from a style of play that first wooed supporters the world over in the 1970s.  If England had half the innate attacking exuberance Wales have produced in this championship, they would not be contemplating the debris of three consecutive defeats. Similarly, Wales have learnt that style alone does not win matches, and that forward power, mental toughness and good decision-making under pressure are equally important. So on to Murrayfield, where Wales have not won on their last three visits. While the hype in the Principality will go into overdrive, the players will set about the task of beating Scotland. Only then - with the visit of Ireland to finish - can they start thinking about emulating the hallowed players of the 1970s, and writing their own names into Welsh legend."
sc847f608619,Souness delight at Euro progress," Boss Graeme Souness felt Newcastle were never really in danger of going out of the Uefa Cup against Heerenveen.  An early own goal followed by an Alan Shearer strike earned them a 2-1 win and a place in the Uefa Cup last 16. ""Obviously with winning in the first leg it gave us a great advantage,"" he said after the 4-2 aggregate victory. ""We got our goals early and in the minds of some players the job was done but then they got a goal and perhaps made us a bit nervous."" Shearer's goal moved him within 12 of Jackie Milburn's club scoring record of 200 for the Magpies. But Souness said he did not think beating the record would have any bearing on his decision to retire at the end of the season. ""I think if he got it this year he would want to stay next year anyway,"" he added.  ""He struck the ball very well - he always has done - and I think it was the power and pace that beat the goalkeeper."" Souness also paid tribute to Laurent Robert, who was at the heart of much of United's attacking play. ""In the first half he did really well and did everything you want from a wide player. More of the same in future please,"" he said."
scc779c1bc17,Houllier praises Benitez regime," Former Liverpool manager Gerard Houllier has praised the work of his Anfield successor Rafael Benitez.  Houllier was angry at reports that he has been critical of Benitez since the Spaniard took over at Liverpool. But Houllier told BBC Sport: ""In private and in public, I have stressed I believe Rafa is doing a good job. He is the right man at the right place. ""Rafa is a good coach and a good man. I've spoken to him since he has been at Liverpool and never criticised him."" Houllier also revealed he is now ready to return to the game after leaving Liverpool in May following six years at Anfield.  The former France boss has been linked with a host of jobs and pulled out of the race to succeed Mark Hughes as Wales national coach. He has been working for Uefa, covering the Premiership for French television and also coaching in Brazil with national coach Carlos Alberto Perreira. Houllier said: ""If a good club comes up at the right time then yes, I am ready to come back. ""It has been interesting to watch games from a different perspective and I have learned things. ""I have been involved in football since leaving Liverpool and my batteries are recharged.""  Houllier has been impressed with the quality in the Premiership after watching as a pundit - particularly with Jose Mourinho's work at leaders Chelsea. He said: ""Chelsea are doing very well. They have some very good creative players in Damien Duff and Arjen Robben and Didier Drogba showed he can change the face of a game when he came on against Newcastle. ""They have got a good team spirit and are strong mentally. They have shown they can cope with all the pressure put on them because of the expectations and cope well with Jose's principles. ""Jose had results before he came to Chelsea and I think he will have an impact in the Premiership because he manages his team very cleverly."" And Houllier, away from his brief at Liverpool, has been hugely impressed with the Premiership. He said: ""It is a very exciting league. It is entertaining, goals are scored and teams are always trying to win. ""It has been very interesting to watch the game from a different perspective. ""Games switch from end-to-end and there is more pace to the Premiership than other leagues. It is a very good product."""
pd8e14207069,"Analysis: No pain, no gain?"," He called it his ""masochism strategy"" in the run-up to the Iraq war and now Tony Blair has signed up for another dose of pain.  The idea is simple - the prime minister goes head to head with an often hostile group of ""real"" voters in the full spotlight of the television cameras. The theory is that talking to the great British public, even if they are the ""great unwashed"", is better than having the media filter what voters hear from politicians. It is also the most effective way of showing that he is aware of real people's concerns and - on occasions - of their outright fury. Mr Blair used the tactic before the Iraq war to try to show he really was engaging with public concerns and you can expect to see it much more in the run-up to the election.  Labour knows it has been damaged by accusations of spin, ""control freakery"" and over-slick presentation - sometimes from within the ranks of its own MPs. Tony Blair himself has said people complain he does not listen. Mr Blair's latest bout of flagellation came with a series of questions sessions on Five television throughout Wednesday.  The trouble began on the Wright Stuff show, with Maria Hutchings marching up to him, saying ""Tony, that's rubbish"" as she tried to complain about her autistic son's school being threatened with closure. A few ""don't worries"" as Mrs Hutchings was led back to the audience averted a public slanging match - he spoke to her privately after the show. But that was only the start and later sessions produced the type of grilling not even the toughest television interviewer could produce.  Writer Neil Coppendale, from West Sussex, asked of the Iraq war: ""Tens of thousands of innocent men, women and children died - how do you manage to sleep at night?"" On immigration, London teacher Diane Granger said: ""Where are you going to put everyone?"" And can you imagine even Jeremy Paxman putting the question posed by Brighton nurse Marion Brown: ""Would you wipe somebody's backside for £5?""  Mr Blair tried to use the questioners' first names - and sometimes threw them off their stride by asking what they would do about the problems. Many of the newspapers have branded the exercise a PR stunt which backfired. Indeed there is a danger Mr Blair simply ends up looking ""embattled"". Conservative Michael Howard and Liberal Democrat Charles Kennedy are to be offered chances to appear in similar slots on the channel next month. Labour strategists believe more of the sessions will mean the hecklers no longer become a story and the real issues take prominence.  James Humphreys, ex-head of corporate communications at Number 10, says the strategy shows frustration with the media. ""They feel they don't get their voice across and going direct to people is clearly their game on this occasion,"" he says. There are risks but the prize is tackling the trend of lower turnouts at the polls, he argues. The prime minister knows full well the potential hazards .  He must remember with gritted teeth his confrontation with Sharron Storer, the Birmingham woman who harangued him over the state of her local hospital in the 2001 election campaign. ""All you do is walk around and make yourself known, you don't do anything to help anybody,"" she told Mr Blair before stomping off, refusing his pleas to discuss the issue privately. Former Downing Street media chief Alastair Campbell has described the episode as a ""bit of a disaster"" as it meant the launch of Labour's election manifesto received little coverage. But it was seen as one of the few moments when that election campaign came alive, not least because it coincided with John Prescott's even more direct contact - when he punched an egg-throwing protester.  Former prime ministers too have come to grief at the hands of a persistent member of the public. The undoubted highlight of years of election phone-in shows was Margaret Thatcher discomfort on Nationwide in 1983, when viewer Diana Gould put her on the spot about the sinking of the Belgrano in the Falklands War. John Major reaped the benefits of street campaigning during the 1992 election campaign with his famous soapbox.  It may have left him splattered with eggs and engine oil at times but he felt it added ""fizz"" to his campaign. In his memoirs, he also argues the strategy contrasted with Neil Kinnock's ""contrived photo opportunities"" and attempts at an artful campaign. ""He wanted to look like a prime minister. I  was  prime minister and I wanted a flesh and blood fight,"" says Mr Major. Mr Blair told prospective Labour MPs on Thursday that taking part in phone-ins and public meetings could ""enthuse and engage and give the public a sense of empowerment"". But he also wants to counter complaints that he has spent too much time on international affairs and foreign trips. Mr Blair recalls how Bill Clinton once advised him: ""Always remember that what people see of you in the news in the evening is how they think you spend your day."" His hope must be that voters watching him on the rack will bear out for Labour the old maxim: ""No pain, no gain."""
pd0f0fa26a93,Howard denies split over ID cards," Michael Howard has denied his shadow cabinet was split over its decision to back controversial Labour plans to introduce ID cards.  The Tory leader said his front bench team had reached a ""collective view"" after holding a ""good discussion"", but admitted it was ""not an easy issue"". He had decided to support the plans as the police said they would help fight terror, crime and illegal immigration. The Lib Dems have pledged to oppose the bill when it is debated next Monday.  Tory sources say senior party figures had argued vociferously against the ID card scheme. Among those reported to have serious reservations over the strategy were senior shadow cabinet members David Davis, Oliver Letwin and Tim Yeo. But Mr Howard denied Mr Yeo, his transport and environment spokesman, said the plans ""stink"". He also said he was confident shadow home secretary Mr Davis would ""set out the position very clearly"" when he stands up to debate the matter next week. Mr Howard said the police had said ID cards could ""help them foil a terror bomb plot in which people could lose their lives"". He added: ""When the police say that you have to take them seriously"".  He acknowledged there were ""good libertarian arguments"" against the cards, but said the shadow Cabinet had weighed up all the ""conflicting interests"" before reaching its decision. ""I don't pretend that it is an easy decision but at the end of the day a decision has to be taken."" He also denied he was afraid of looking ""soft"" on the issue, compared to Labour. The Conservatives announced their support for the government plans on Monday evening.  Sources within the party told the BBC Mr Howard had always been in favour of ID cards, and tried to introduce them when he was Home Secretary. But the Tories insisted they would hold ministers to account over the precise purpose of the scheme.  They said they would also press Labour over whether objectives could be met and whether the Home Office would be able to deliver them. And they pledged to assess the cost effectiveness of ID cards and whether people's privacy would be properly protected. ""It is important to remember that this bill will take a decade to come into full effect,"" a spokesman said. Lib Dem home affairs spokesman Mark Oaten has branded the ID scheme a waste of money and ""deeply flawed"". He said: ""This has all the signs of Michael Howard overruling colleagues' concerns over ID cards.""  The chairman of the Bar Council, Guy Mansfield QC warned there was a real risk that people on the ""margins of society"" would be driven into the hands of extremists. ""What is going to happen to young Asian men when there has been a bomb gone off somewhere? They are going to be stopped. If they haven't [ID cards] they are going to be detained."" Tory ex-minister Douglas Hogg said he opposed the plans for ID cards branding them a ""regressive"" step which would intrude into the lives of ordinary citizens without any counterbalancing benefits. He predicted ultimately carrying the cards would become compulsory and that would lead to large numbers of Britain's ethnic minorities being stopped by police."
pdf35f8013b5,Blair pledges unity to Labour MPs," Tony Blair has sought to reassure Labour backbenchers that nothing will stand in the way of the party's bid for a third term in power.  Mr Blair was speaking to MPs amid fresh rumours of a rift with Gordon Brown. A new book says the prime minister went back on a pledge to Mr Brown to stand down before the next general election. The chancellor has said he is focused on winning the poll and is due to join election supremo Alan Milburn for a Labour poster launch this week. Mr Blair told the Parliamentary Labour Party (PLP) on Monday: ""I know from everyone here, in Cabinet and government, nothing is going to get in the way of a unified Labour Party with a unified position and winning the third term people desperately need."" The prime minister and his chancellor arrived within seconds of each other and seemingly in good spirits at the start of the meeting which lasted around an hour. A new book, Brown's Britain by Sunday Telegraph journalist Robert Peston, says Mr Blair went back on a pledge to make way for Mr Brown after Cabinet allies intervened in June 2004.  It has caused a new wave of concern among Labour MPs gearing up to defend their seats in an election, widely expected to be held in May, and several members are understood to have lined up to express their discontent at the PLP meeting. Health Secretary John Reid earlier warned that Labour members would not easily forgive anybody fuelling damaging speculation. He told BBC News: ""Those who co-operate or inspire these books, in my view, have to know that, whatever the short-term political or personal advantage that they think they might secure, they always do it by damaging the record, the unity and the re-election chances of the Labour Party and the government."" Mr Blair on Sunday dismissed claims of broken promises, saying: ""I've dealt with this six months ago. I said then you don't do deals over jobs like this - you don't.""  In a separate BBC interview, Mr Brown said he and the prime minister would not be distracted by ""gossip"". ""It's very important that we all do what we can in a unified way to ensure the election of a Labour government,"" he said.  On Monday, Mr Blair's spokesman said: ""The prime minister is determined that he will get on with the business of government because he believes that what people want."" Mr Brown says he discussed the election campaign with Mr Blair on Saturday and promised to play his part.  Mr Peston said the pair had ""mutual animosity and contempt"". Mr Blair had decided in November 2003 he would quit because he felt he had lost voters' trust because of the Iraq war.  He had then changed his mind in June 2004, following intervention from Cabinet allies and suspicion that the chancellor was manoeuvring against him. Mr Brown allegedly said he could no longer believe anything Mr Blair told him. Conservative co-chairman Liam Fox likened the two men to ""self-obsessed schoolboys"". Liberal Democrat parliamentary chairman Matthew Taylor said their personal ambition was ""getting in the way of good government"". Ex-Labour leader Neil Kinnock said Mr Blair and Mr Brown could only deal with the media frenzy by continuing to say they would not allow a row to damage Labour or British interests. He told BBC Radio Five Live that Mr Brown would never encourage any kind of insurrection or coup."
pda7a4b979ac,"Nat Insurance to rise, say Tories"," National Insurance will be raised if Labour wins the next election, Tory leader Michael Howard has claimed.  Tony Blair has said he does not want higher tax rates for top earners but on Wednesday said other tax promises would be left to Labour's manifesto. Prime minister's questions also saw Mr Blair predict that new plans would probably cut net immigration. He attacked Tory plans to process asylum claims abroad - but Mr Howard said Labour had proposed the idea too.  The Commons questions session again saw the leaders of the two biggest parties shape up for the forthcoming election campaign. The Tories have promised £4bn in tax cuts but have yet to say where they will fall. Mr Howard pointed to the Institute for Fiscal Studies' predictions that Labour will need to increase taxes to cover an £11bn gap in its spending plans. He accused ministers of wasting money on unsuccessful attempts to curb bad behaviour and truancy in schools and on slow asylum processing. It was no good Mr Blair claiming tax pledges were being left to the manifesto as he had given one to MPs on Tuesday about the top rate of income tax, argued Mr Howard. Pointing to national insurance, he added: ""Everyone knows tax will go up under Labour: isn't it now clear which tax it would be?""  Mr Blair instead hailed Labour's achievement in using a strong economy to invest in public services. ""When we have money not only going into extra teachers and nurses but equipment in schools and hospitals, that money is not wasted,"" he said. On the tax questions, he added: ""We will make commitments on tax at the time of the manifesto."" Home Secretary Charles Clarke this week published plans for a new points system for economic migrants, with only high-skilled workers allowed into the UK from outside the European Union.  Mr Blair said abuses would be weeded out and chain migration, where families automatically get the right to settle with immigrant workers, would end. That would probably create a fall in the migrant numbers, he said. The prime minister ridiculed the Tory plans for asylum quotas and for processing all asylum claims overseas. He challenged the Tories on which country would house their processing centres - what he called a ""fantasy island"". Mr Howard read from a letter about the government's own plans at the European Council of Ministers for processing asylum seekers outside the EU. But Mr Blair said: ""All the other countries could not agree on the way forward, nor could the UN."""
pda9f0bd8144,Lib Dems stress Budget trust gap," Public trust in the handling of the economy can only be restored if Gordon Brown opens up his books for unbiased inspection, say the Lib Dems.  City experts say there is a £10bn ""black hole"" in the public finances, a claim denied by the chancellor. Lib Dem spokesman Vince Cable said the public did not know who to believe and the National Audit Office should judge. Responding to the pre-Budget report, Mr Cable also attacked Labour's ""unfair"" and over-complicated taxes.  In his report, Mr Brown insisted he was on course to meet his ""golden rule"" of borrowing only to invest, rather than for day-to-day spending, over the course of the economic cycle. Mr Cable said people did not know whether to believe the chancellor or the consensus among experts which said the rule would be broken. ""There is an issue of credibility and trust,"" he said. ""We cannot have a continuation of a situation where the chancellor sets his own tests and then marks them. ""What we need is the equivalent of a thorough Ofsted inspection of the government's accounts."" He asked what the government had to hide.  Mr Cable also accused the chancellor of ducking tough choices. He argued: ""There are serious challenges ahead from the falling dollar and from the rapid downturn in the UK housing market and rising personal debt. But they have not been confronted."" Mr Brown confirmed he was setting aside another £520m for the conflicts in Iraq and Afghanistan. Mr Cable compared that new cost with the £500m needed for Britain's role in the entire first Gulf War - when 80% of the bill had been met through help from European and Arab nations. He suggested keeping British troops in Iraq could cost another £1bn with the government also planning to spend at least £3bn for identity cards. The current economic climate meant Britain could not afford the ""reckless, George Bush-style tax cutting spree"" planned by the Tories, he said. Instead, what was needed was simple and fair taxation rather than the ""complete mess"" produced by Mr Brown's endless tinkering.  Mr Cable said 40% of all pensioners were now paying marginal tax rates of 50%. And one-and-a-half million hard working families were paying 60% marginal tax rates. With that record, he asked why ministers attacked Lib Dem plans for a new 50% tax rate for the ""very rich"" - those earning more than £100,000 a year. Mr Brown earmarked £1bn to help keep down council tax rises next year. But the Lib Dem spokesman questioned whether that money was being found from cuts to education and health. He urged the government to scrap the ""grossly unfair"" tax completely. The Lib Dems want it replaced with a local income tax. In response, Mr Brown stressed the Iraq money came from a reserve funds. It was because he had rejected previous Lib Dem proposals, such as scrapping the New Deal, that Britain's economy was successful, claimed Mr Brown."
