altid,title,content
sa1a70ab8ef5,Davenport hits out at Wimbledon," World number one Lindsay Davenport has criticised Wimbledon over the issue of equal prize money for women.  Reacting to a disputed comment by All England Club chairman Tim Phillips, the American said: ""I think it is highly insulting if prize money is taken away. ""Somebody, I think it was Mr Phillips, said they won't have money for flowers at Wimbledon. That's insulting."" An All England club spokesperson denied Phillips made the remark, insisting: ""He definitely didn't say it."" The statement added: ""It was said by someone else and was a humorous aside at the end of a radio interview when the conversation had moved to talking about the Wimbledon grounds.""  Davenport was speaking following the announcement that this week's Dubai Duty Free event will join the US and Australian Opens in offering equal prize money for women. ""You hear about women playing only three sets while men play five,"" said Daveport. ""And the best women are never going to beat the best men. ""But it's a different game you go to watch with the women - it doesn't make it better or worse. ""Hopefully we will be able to change people's minds."" Serena Williams, who is also in Dubai, added: ""I'm obviously for equal prize money. ""Women's tennis is exciting. Men's tennis is exciting as well, but the women have it right now. ""If you are bringing in the spectators you should be able to reap what everyone else is able to reap."""
ta497aea0e36,Camera phones are 'must-haves'," Four times more mobiles with cameras in them will be sold in Europe by the end of 2004 than last year, says a report from analysts Gartner.  Globally, the number sold will reach 159 million, an increase of 104%. The report predicts that nearly 70% of all mobile phones sold will have a built-in camera by 2008. Improving imaging technology in mobiles is making them an increasingly ""must-have"" buy. In Europe, cameras on mobiles can take 1.3 megapixel images. But in Japan and Asia Pacific, where camera phone technology is much more advanced, mobiles have already been released which can take 3.2 megapixel images. Japan still dominates mobile phone technology, and the uptake there is huge. By 2008, according to Gartner, 95% of all mobiles sold there will have cameras on them.  Camera phones had some teething problems when they were first launched as people struggled with poor quality images and uses for them, as well as the complexity and expense of sending them via MMS (Multimedia Messaging Services). This has changed in the last 18 months. Handset makers have concentrated on trying to make phones easier to use. Realising that people like to use their camera phones in different ways, they have introduced more design features, like rotating screens and viewfinders, removable memory cards and easier controls to send picture messages.  Mobile companies have introduced more ways for people to share photos with other people. These have included giving people easier ways to publish them on websites, or mobile blogs - moblogs. But the report suggests that until image quality increases more, people will not be interested in printing out pictures at kiosks. Image sensor technology inside cameras phones is improving. The Gartner report suggests that by mid-2005, it is likely that the image resolution of most camera phones will be more than two megapixels. Consumer digital cameras images range from two to four megapixels in quality, and up to six megapixels on a high-end camera. But a lot of work is being done to make camera phones more like digital cameras. Some handsets already feature limited zoom capability, and manufacturers are looking into technological improvements that will let people take more photos in poorly-lit conditions, like nightclubs. Other developments include wide-angle modes, basic editing features, and better sensors and processors for recording film clips.  Images from camera phones have even made it into the art world. An exhibition next month in aid of the charity Mencap, will feature snaps taken from the camera phones of top artists.  The exhibition, Fonetography, will feature images taken by photographers David Bailey, Rankin and Nan Goldin, and artists Sir Peter Blake, Tracey Emin and Jack Vettriano. But some uses for them have worried many organisations. Intel, Samsung, the UK's Foreign Office and Lawrence Livermore National Laboratories in the US, have decided to ban camera phones from their buildings for fear of sensitive information being snapped and leaked. Many schools, fitness centres and local councils have also banned them over fears about privacy and misuse. Italy's information commissioner has also voiced concern and has issued guidelines on where and how the phones can be used. But camera phone fears have not dampened the manufacturers' profits. According to recent figures, Sony Ericsson's profits tripled in the third-quarter because of new camera phones. Over 60% of mobiles sold during the three months through to September featured integrated cameras, it said."
ta0f0fa26a93,US top of supercomputing charts," The US has pushed Japan off the top of the supercomputing chart with IBM's prototype Blue Gene/L machine.  It is being assembled for the Lawrence Livermore National Laboratory, under the US Department of Energy. IBM test results show that Blue Gene/L has managed speeds of 70.72 teraflops. The previous top machine, Japan's NEC Earth Simulator, clocked up 35.86. The Top 500 list was announced on Monday and officially charts the fastest computers in the world.  It is announced every six months and is worked out using an officially recognised mathematical speed test called Linpack which measures calculations per second.  Once completed in 2005, Blue Gene/L will be more powerful than its current prototype. ""Next year with the final Blue Gene, four times what it is this year, it is going to be a real step up and will be hard to beat,"" said Erich Strohmaier, one of the co-founders of the Top500 list. It will help scientists work out the safety, security and reliability requirements for the US's nuclear weapons stockpile, without the need for underground nuclear testing. It will also cut down on the amount of heat generated by the massive power, a big problem for supercomputers.  In second place was Silicon Graphics' Columbia supercomputer based at the US space agency's (Nasa) Ames Research Center in California. The Linux-based machine was reported to have reached a top speed of 42.7 trillion calculations per second (teraflops) in October. It will be used to model flight missions, climate research, and aerospace engineering. The defeated Japanese contender, the Earth Simulator, which was listed in third place, losing the top spot it had held since June 2002. It is dedicated to climate modelling and simulating seismic activity.  Since the first supercomputer, the Cray-1, was installed at Los Alamos National Laboratory, US, in 1976, computational speed has leaped 500,000 times. The Cray-1 was capable of 80 megaflops (80 million operations a second). The Blue Gene/L machine that will be completed next year will be five million times faster. Started in 1993, the Top 500 list is decided by a group of computer science academics from around the world. It is presented at the International Supercomputer Conference in Pittsburgh."
ba23aaa4f4bb,Trial begins of Spain's top banker," The trial of Emilio Botin, the chairman of Spain's most powerful bank, Santander Central Hispano, has started in Madrid.  Mr Botin is accused of misusing the bank's funds after he approved the payment of 160m euros ($208m; £111m) in bonus and pension payouts to two former executives. However, the trial was suspended when Mr Botin's lawyer introduced a new set of documents on the day testimony was set to begin. A three-judge panel gave prosecution lawyers until Monday to study the documents, when the trial will be reconvened.  The high-profile case began after two Santander shareholders filed a criminal complaint about the payments to Jose Maria Amusategui and Angel Corcostegui, who stepped down in 2001. Both executives helped Mr Botin orchestrate Spain's biggest bank merger, between Santander and Banco Central Hispano, in 1999. As he arrived at Spain's High Court earlier on Wednesday, Mr Botin greeted the waiting media, saying: ""I have full faith in justice."" Santander's board of governors strongly reject the charges against their chairman, saying the payouts were legal and made with their unanimous support. But if convicted, Mr Botin could face a prison term of up to six years. Mr Corcostegui, a former CEO at Santander, also asked the court for new evidence to be admitted. In spite of the allegations against him, Mr Botin continues to lead Santander, and was instrumental in the £8.5bn takeover last November of the British bank Abbey National. Since taking over the chairmanship in 1986, he has turned Santander into one of the top ten biggest banks in the world."
baa126aeb946,Safety alert as GM recalls cars," The world's biggest carmaker General Motors (GM) is recalling nearly 200,000 vehicles in the US on safety grounds, according to federal regulators.  The National Highway Traffic Safety Administration (NHTSA) said the largest recall involves 155,465 pickups, vans and sports utility vehicles (SUVs). This is because of possible malfunctions with the braking systems. The affected vehicles in the product recall are from the 2004 and 2005 model years, GM said. Those vehicles with potential faults are the Chevrolet Avalanche, Express, Kodiak, Silverade and Suburban; the GMC Savana, Sierra and Yukon.  The NHTSA said a pressure accumulator in the braking system could crack during normal driving and fragments could injure people if the hood was open. This could allow hydraulic fluid to leak, which could make it harder to brake or steer and could cause a crash, it warned. GM is also recalling 19,924 Cadillac XLR coupes, SRX SUVs and Pontiac Grand Prix sedans from the 2004 model year. This is because the accelerator pedal may not work properly in extremely cold temperatures, requiring more braking. In addition, the car giant is calling back 17,815 Buick Raniers, Chevrolet Trailblazers, GMC Envoys and Isuzu Ascenders from the 2005 model years because the windshield is not properly fitted and could fall out in a crash. However, GM stressed that it did not know of any injuries related to the problems. News of the recall follows an announcement last month that GM expects earnings this year be lower than in 2004. The world's biggest car maker is grappling with losses in its European business, weak US sales and now a product recall. In January, GM said higher healthcare costs in North America, and lower profits at its financial services subsidiary would hurt its performance in 2005."
saa0c6292a37,Angry Williams rejects criticism," Serena Williams has angrily rejected claims that she and sister Venus are a declining force in tennis.  The sisters ended last year without a Grand Slam title for the first time since 1998. But Serena denied their challenge was fading, saying: ""That's not fair - I'm tired of not saying anything. ""We've been practising hard. We've had serious injuries. I've had surgery and after, I got to the Wimbledon final. I don't know many who have done that."" While Serena is through to the Australian Open semi-finals, Venus went out in the fourth round, meaning she has not gone further than the last eight in her last five Grand Slam appearances. But Serena added: ""Venus had a severe strain in her stomach. I actually had the same injury, but I didn't tear it the way she did.  ""If I would have torn it, I wouldn't have been here. ""She played a player (Alicia Molik) that just played out of her mind and Venus made some errors that she probably shouldn't have made."" Serena also said people tended to forget the impact the 2003 murder of sister Yetunde Price had had on the family. ""To top it off, we have a very, very, very, very, very close family"" Serena continued. ""To be in some situation that we've been placed in in the past little over a year, it's not easy to come out and just perform at your best when you realize there are so many things that are so important. ""So, no, we're not declining. We're here. I don't have to win this tournament to prove anything. I know that I'm out here and I know that I'm one of the best players out here."""
pa0f562ea8a2,E-University 'disgraceful waste'," A failed government scheme to offer UK university courses online has been branded a ""disgraceful waste"" by MPs.  The e-University was scrapped last year, having attracted only 900 students at a cost of £50m. Chief executive John Beaumont was paid a bonus of £44,914, despite a failure to bring in private sector backers. The Commons education select committee called this ""morally indefensible"" but the government said the e-University project had ""improved understanding"".  A Department for Education and Skills spokeswoman said the venture had been ""ambitious and ground-breaking, but take-up had not been ""sufficient to continue with the project"". She added: ""UK e-Universities was not the only organisation to have lost out on private sector investment in the collapse of the dotcom boom."" The select committee found that those responsible for founding the e-University in 2000 had been caught up in the ""general atmosphere of enthusiasm"" surrounding the internet. Initial business plans forecast a quarter of a million students joining within a decade, bringing in at least £110m in profit.  But virtually no market research was carried out and just £4.2m was spent on worldwide sales and marketing of courses. Some £14m went on developing the technology to make the e-University work. This was used by just 200 students, the rest preferring to work through existing university websites. With no significant private investors and no direct accountability to a government minister, the e-University had had ""too much freedom to spend public money as it wished"", the report found. Committee chairman Barry Sheerman said: ""UK e-University was a terrible waste of public money. ""The senior executives failed to interest any private investors and showed an extraordinary over-confidence in their ability to attract students to the scheme."" The report warns that the government should not be scared off investment in innovative but potentially risky schemes by the failure of the e-University, but ""should learn the lessons from this disaster""."
ea6b1e0f27d6,India to deport Bollywood actress," India has ordered the deportation of Iranian-born model and actress Negar Khan to Norway after saying she was working illegally on her visa.  Khan has had raunchy roles in music videos and Bollywood films over the past two years. The distressed actress told media she was being driven straight to the airport after a routine appointment at the Bombay immigration office. Immigration officials said she had been warned about her visa last year.  Khan told an Indian news channel on her mobile phone: ""They are not even letting me go home to get my bags. I have no clothes or money on me. ""They did not give me any notice. I don't know why they are taking me away like this. There is nothing wrong with my visa. It says I work here... They are not allowing me to even call a lawyer."" Bipin Bihari, deputy police chief in Bombay, said Khan was being sent back to Norway, from which she holds a passport, on the first available flight. ""She was on a visitor's visa but she has engaged in several commercial ventures,"" he said. ""We issued notices last year, in view of which she had gone back to Norway, but she has returned again this year to work."" One of Khan's biggest successes was the steamy Hindi song Chadti Jawani (Rising Youth). Khan was involved in controversy when topless photos alleged to be of her appeared in a Norwegian magazine."
ta74d0c14217,Web radio takes Spanish rap global," Spin the radio dial in the US and you are likely to find plenty of Spanish-language music. But what you will not find is much Spanish-language hip-hop.  Hip-hop and rap are actually quite popular in the Spanish-speaking world, but local artists are having trouble marketing their work abroad. But now, a US company is bringing rap and hip-hop en espanol to computer users everywhere. Los Caballeros de Plan G are one of Mexico's hottest hip-hop acts. They have a devoted fan base in their native Monterrey. But most Mexican hip-hop fans, not to mention fans in most of the Spanish-speaking world, rarely get a chance to hear the group's tracks on the radio.  ""You can't really just go on the radio and listen to hip-hop in Spanish... it's just not accessible,"" says Manuel Millan, a native of San Diego, California. ""It's really hard for the Spanish hip-hop scene to get into mainstream radio. You usually have a very commercialised sound and the groups are not really known around the country or around the world."" Millan and two friends set out to change that - they wanted to make groups like Los Caballeros de Plan G accessible to fans globally.  Mainstream radio stations were not going to play this kind of music, and starting their own broadcast station was economically impossible. So, Millan and his friends launched a website called latinohiphopradio.com. The name says it all: it is web-based radio, devoted to the hottest Spanish language rap and hip-hop tracks. The site, which is in both in English and Spanish, is meant to be easy to navigate. All the user has to do is download a media player. There are no DJs. It is just music streamed over the net for free. Suddenly, with the help of the website, Los Caballeros de Plan G are producing ""export quality"" rap.  The web might be just the right medium for Spanish language hip-hop right now. The genre is in what Millan calls its ""infant stage"". But the production values are improving, and artists such as Argentina's Mustafa Yoda are pushing to make it better and better. Mustafa Yoda is currently one of the hottest tracks on latinohiphopradio.com. ""He's considered the Eminem of Argentina, and the Latin American hip-hop scene,"" Millan says. ""He really hasn't had that much exposure as far as anywhere in the world, but he's definitely the one to look out for as far as becoming the next big thing in the Spanish-speaking world."" Currently, the Chilean group Makisa is also in latinohiphopradio.com's top 10, as is Cuban artist Papo Record. ""Every country's got it's own cultural differences and they try to put those into their own songs,"" Millan says. Latinohiphopradio.com has been up and running for a couple of months now. The site has listeners from across the Spanish speaking world. Right now, Mexico leads the way, accounting for about 50% of listeners. But web surfers in Spain are logging in as well - about 25% of the web station's traffic comes from there. That is not surprising as many consider Spain to be the leader in Spanish-language rap and hip-hop. Millan says that Spain is actually just behind the United States and France in terms of overall rap and hip-hop production. That might be changing, though, as more and more Latin American artists are finding audiences.  But one Spaniard is still firmly in latinohiphopradio.com's top 10. His name is Tote King and Manuel Millan says that he is the hip-hop leader in Spain. On his track Uno Contra Veinte Emcees, or One Against 20 Emcees, Tote King shows he is well aware of that fact. ""It's basically him bragging that he's one of the best emcees in Spain right now,"" Millan says. ""And it's pretty much true. He has the tightest productions, and his rap flow is impeccable, it's amazing."" Latinohiphopradio.com is hoping to expand in the coming year. Millan says they want to include more music and more news from the world of Spanish language hip-hop and rap.  Clark Boyd is technology correspondent for The World, a BBC World Service and WGBH-Boston co-production."
babc125887b7,Ailing EuroDisney vows turnaround," EuroDisney, the European home of Mickey Mouse and friends, has said it will sell 253m euros (£175m; $328m) of new shares as it looks to avoid insolvency.  The sale is the last part of a plan to restructure 2.4bn euros-worth of debts. Despite struggling since it was opened in 1992, EuroDisney has recently made progress in turning its business around and ticket sales have picked up. However, analysts still question whether it attracts enough visitors to stay open, even with the restructuring.  EuroDisney remains Europe's largest single tourist attraction, attracting some 12.4 million visitors annually. A new attraction - Walt Disney Studios - has recently opened its site near Paris. The company's currently traded stock tumbled in Paris on the latest news, shedding 15% to 22 euro cents. EuroDisney will sell the new shares priced at 9 euros cents each. The US Disney Corporation and Saudi Arabian prince Al-Walid bin Talal, the firm's two main shareholders, will buy the new stock. The restructuring deal is the second in the firm's troubled financial history; its finances were first reorganised in 1994."
eb847f608619,Eminem beats Elvis to number one," Rapper Eminem has denied Elvis his fourth number one of the year, after his song, Like Toy Soldiers, stormed to the top of the singles charts.  The track claimed the top spot ahead of The King's latest re-release, Are You Lonesome Tonight. It is the fifth in a series of 18 reissues to mark the 70th anniversary of Presley's birth. Almost Here, the duet from former Westlife star Brian McFadden and Delta Goodrem, went in at number three.  Like Toy Soldiers, from Eminem's Encore album, is sampled from Martika's 1980s hit Toy Soldiers. It takes a swipe at hip-hop feuds and follows the success of Just Lose It. Last week's number one, Elvis's It's Now or Never, slipped 13 places to number 14, but all five of his re-released songs are in the Top 40. One World Project Tsunami fundraiser, Grief Never Grows Old, slipped four places to number eight. Featuring Cliff Richard and Boy George, the song was written by former DJ Mike Read. In the album charts, Athlete's latest offering Tourist claimed the top spot, toppling the Chemical Brother's Push The Button Down, which fell to number six."
eb463fa57b3d,Rapper 50 Cent ends protege feud," Rapper 50 Cent has ended his public feud with his protege The Game as the pair said they wanted to be good role models for their communities.  The row blew up when 50 Cent threw The Game out of his G-Unit crew and accused him of being disloyal. A member of The Game's entourage was reportedly shot outside a radio station where 50 Cent was being interviewed. But the pair shook hands as they handed over money to music projects for New York's deprived areas on Wednesday.  The Game, whose real name is Jayceon Taylor, told a news conference: ""I want to apologise. I'm almost ashamed to have participated in the things that went on over the last few weeks."" Chart-topper 50 Cent, real name Curtis Jackson, said the truce came on the anniversary of the death of the Notorious BIG in 1997, who was part of a volatile feud between the east and west coast rap scenes. ""We're here today to show that people can rise above the most difficult circumstances and together we can put negativity behind us,"" 50 Cent said.  ""A lot of people don't want to see it happen, but we're responding to the two most important groups - our family and our fans."" The Boys Choir of Harlem got a cheque for $150,000 (£77,800) from 50 Cent, while The Game handed over $103,500 (£53,400). The Game also made a contribution to the Compton schools music programme. 50 Cent announced he has launched the G-Unity Foundation ""to help people overcome obstacles and make a chance for the better in their lives"".  ""I realised that if I'm going to be effective at that, I have to overcome some of my own,"" he said. ""Game and I need to set an example in the community."" 50 Cent is no stranger to feuds, with rapper Ja Rule among the targets for ridicule in his songs. On his latest album, released earlier this month, he turned his attentions to Fat Joe and Nas, who have both worked with Ja Rule. Both he and The Game have admitted drug dealing in the past and have both been shot."
