altid,title,content
be708dc73ba5,Huge rush for Jet Airways shares," Indian airline Jet Airways' initial public offering was oversubscribed 16.2 times, bankers said on Friday.  Over 85% of the bids were at the higher end of the price range of 1,050-1,125 rupees ($24-$26). Jet Airways, a low-fare airline, was founded by London-based ex-travel agent Naresh Goya, and controls 45% of the Indian domestic airline market. It sold 20% of its equity or 17.2 million shares in a bid to raise up to $443m (£230.8m). The price at which its shares will begin trading will be agreed over the weekend, bankers said. ""The demand for the IPO was impressive. We believe that over the next two years, the domestic aviation sector promises strong growth, even though fuel prices could be high,"" said Hiten Mehta, manager of merchant banking firm, Fortune Financial Services. India began to open up its domestic airline market - previously dominated by state-run carrier Indian Airlines - in the 1990s. Jet began flying in 1993 and now has competitors including Air Deccan and Air Sahara. Budget carriers Kingfisher Airlines and SpiceJet are planning to launch operations in May this year. Jet has 42 aircraft and runs 271 scheduled flights daily within India. It recently won government permission to fly to London, Singapore and Kuala Lumpur."
bec779c1bc17,Tsunami 'to hit Sri Lanka banks'," Sri Lanka's banks face hard times following December's tsunami disaster, officials have warned.  The Sri Lanka Banks Association said the waves which killed more than 30,000 people also washed away huge amounts of property which was securing loans. According to its estimate, as much as 13.6% of the loans made by private banks to clients in the disaster zone has been written off or damaged. State-owned lenders may be even worse hit, it said.  The association estimates that the private banking sector has 25bn rupees ($250m; £135m) of loans outstanding in the disaster zone. On one hand, banks are dealing with the death of their customers, along with damaged or destroyed collateral. On the other, most are extending cheap loans for rebuilding and recovery, as well as giving their clients more time to repay existing borrowing. The combination means a revenue shortfall during 2005, SLBA chairman - and Commercial Bank managing director - AL Gooneratne told a news conference. ""Most banks have given moratoriums and will not be collecting interest, at least in this quarter,"" he said. In the public sector, more than one in ten of the state-owned People's Bank's customers in the south of Sri Lanka were affected, a bank spokesman told Reuters. He estimated the bank's loss at 3bn rupees."
be361f68f1c0,Fresh hope after Argentine crisis," Three years after Argentina was hit by a deadly economic crisis, there is fresh hope.  The country's economy is set to grow about 8% this year after seeing 9% growth last year, a sharp turnaround from 2002 when output fell 11%. The unemployment rate is improving, too: It is set to slip below 13% by the end of the year, down from 20% in May 2002. True, problems remain, but the overall picture is one of vast improvement. Even the International Monetary Fund (IMF) admits this. ""The Argentine authorities are proud, should be proud, of the strong performance of the economy,"" Thomas Dawson, an IMF director, said earlier this month.  Argentina has made a remarkable recovery from a hideous and lengthy recession which in 2001 culminated in the government halting debt repayments to its private creditors. The debt default sparked a deep and prolonged economic crisis which, at least initially, was made worse by the government's decisions. Pension payments were halted and bank accounts frozen as part of austerity measures introduced by the government to deal with the country's massive debts. In response, angry crowds of ordinary Argentines took to the streets where dozens of lives were lost in clashes with the police. Two presidents and at least three finance minister resigned in less than a month. Argentina was on the brink of collapse. The fix was found in the currency markets with the abandonment of the peso's decade-long peg to the US dollar in February 2002. The subsequent devaluation saw thousands of people's life savings disappear. Scathes of companies went bust. ""Three years ago, every sector [of the economy] was hit by the crisis,"" said entrepreneur Drayton Valentine. It really was dire.  But since then, the general mood on the ground has improved dramatically, in part because the devaluation helped attract fresh direct investment from abroad and stimulate business within Brazil. ""Agriculture and tourism are helping,"" said entrepreneur Drayton Valentine.  Mr Valentine, who was born in the United States but grew up in Argentina, was fortunate: At the time of the crisis, his savings were held in dollar accounts abroad. But now he is using his money to help with the start-up a trading company. He explained that initially, his firm is going to export building materials to Spain and United States. Then, he would like to diversify to other areas, depending on the market. ""Locally there is a sense of recovery, many companies are exporting now,"" he said, noting that a lot of firms, which were closed during the crisis, are re-opening.  But not all that shines is gold. Argentina is still burdened by its failure to pay private creditors at the end of 2001. President Nestor Kirchner's administration is still trying to hammer out an agreement with the creditors, but with the debts' nominal value standing at around $100bn it is not proving easy. Debt defaults make further lending agreements both difficult and expensive to negotiate. Argentina's current offer implies that the creditors would get just 25 cents for each dollar they are owed, according to the creditors. Understandably, they want more and until they do, both they and others are loath to continue lending. For President Kirchner, this proves a hopeless challenge. Real losses have been suffered and somebody has to pay, observed Jack Boorman, adviser to IMF's managing director, Rodrigo Rato. ""Everyone needs to keep in mind the enormous cost on the part of both creditors and the Argentine society and people that will have been endured by the time a settlement is reached,"" he said. ""The cost is enormous, and continues to be paid, and will not be reversed by any restructuring.""  With the international negotiations being troubled, it is of little help to President Kirchner that the domestic situation remains strained as well.  This is partly because there are still bank account holders who are waiting to recover some of their deposits. ""The situation is bad for those who had previously chosen to save in Argentina, "" said Carlos Baez Silva, president of AARA, an association that represents bank account and bond holders. Few people have recovered more than about half their savings, Mr Baez Silva estimated, pointing out that many of the savers who have lost out are pensioners or others who once trusted the government, people who set aside money for the future in the belief that their investment would be safe. ""A lot of them invested in good faith,"" he said. ""The Argentine state responded by taking most of their investments."" The affair has made Mr Baez Silva disillusioned with the country's legal system. On occasion, the Supreme Court has ruled against the interests of the people he represents, he says, insisting that the system cannot be trusted. ""People have to deposit their money in the banks, not necessarily because they trust them but because crime is so high that people cannot have their money in their homes beneath their mattresses."" Mr Valentine, who was born in the United States but grew up in Argentina, agreed. ""If I have to save pesos [the local currency] there is not much problem, but I will think twice before I deposit dollars in a bank""."
be1a70ab8ef5,UK interest rates held at 4.75%," The Bank of England has left interest rates on hold again at 4.75%, in a widely-predicted move.  Rates went up five times from November 2003 - as the bank sought to cool the housing market and consumer debt - but have remained unchanged since August. Recent data has indicated a slowdown in manufacturing and consumer spending, as well as in mortgage approvals. And retail sales disappointed over Christmas, with analysts putting the drop down to less consumer confidence.  Rising interest rates and the accompanying slowdown in the housing market have knocked consumers' optimism, causing a sharp fall in demand for expensive goods, according to a report earlier this week from the British Retail Consortium. The BRC said Britain's retailers had endured their worst Christmas in a decade.  ""Today's no change decision is correct,"" said David Frost, Director General of the British Chambers of Commerce (BCC). ""But, if there are clear signs that the economy slows, the MPC should be ready to take quick corrective action and cut rates. ""Dismal reports from the retail trade about Christmas sales are worrying, if they indicate a more general weakening in consumer spending.""  Mr Frost added: ""The housing market outlook remains highly uncertain. ""It is widely accepted that, if house prices start falling more sharply, the risks facing the economy will worsen considerably."" CBI chief economist Ian McCafferty said the economy had ""slowed in recent months in response to rate rises"" but that it was difficult to gauge from the Christmas period the likely pace of activity through the summer. ""The Bank is having to juggle the emergence of inflationary pressures, driven by a tight labour market and buoyant commodity prices, against the risk of an over-abrupt slowdown in consumer activity,"" he said. ""Interest rates are likely to remain on hold for some time.""  On Thursday there was more gloomy news on the manufacturing front, as the Office for National (ONS) statistics revealed British manufacturing output unexpectedly fell in November - for the fifth month in the past six. The ONS said manufacturing output dropped 0.1% in November, matching a similar unrevised fall in October and confounding economists' expectations of a 0.3% rise. Manufacturers' organisation, the EEF, said it expected the hold in interest rates to continue in the near future. It also said there was evidence that manufacturers' confidence may be waning as the outlook for the world economy becomes more uncertain.  ""So far the evidence suggests that last year's rate increases have helped to rebalance the economy without damaging the recovery in manufacturing,"" said EEF chief economist, Steve Radley. ""However, should the business outlook start to deteriorate, the Bank should stand ready to cut rates."" Some economists have predicted rates will drop later in the year, although others feel the Bank may still think there is a need for a rise to 5% before that happens. The Bank remains concerned about the long-term risks posed by personal debt - which is rising at 15% a year - if economic conditions worsen."
tfaa05f305c2,Local net TV takes off in Austria," An Austrian village is testing technology that could represent the future of television.  The people of Engerwitzdorf are filming, editing and producing their own regional news channel. The channel covers local politics, sports, events and anything that residents want to film and are prepared to upload for others to watch on PCs. The pilot has been so successful that Telekom Austria is now considering setting up other projects elsewhere.  ""It's growing unbelievably fast,"" said Rudolf Fischer, head of Telekom Austria's fixed line division. The trial of Buntes Fernsehen (Multi-Coloured TV) was started in late 2004 and creates a net-based TV station run by the 8,000 residents of Engerwitzdorf. The hardware and software to turn video footage into edited programmes has been provided by Telekom Austria but this equipment, following training, has been turned over to the villagers. Any video programme created by the villagers is uploaded to a Buntes Fernsehen portal that lets people browse and download what they want to watch. Most people watch the TV on their home PC and a broadband connection is needed to get broadcast quality programmes. In the first four months of the project villagers have created 60 films and put together regular reports on local news items. ""They have adopted it very quickly,"" said Mr Fischer. ""They like the possibility to create their own content and see what's going on in the area."" ""It's kind of the democratisation of local TV,"" he said, ""because none of the bigger broadcasters would ever do anything like this for that region."" The Buntes Fernsehen project has been such a success that Telekom Austria is now considering setting up other schemes in similarly rural areas. Mr Fischer said it was taking the roll-out to other areas slowly because of the work involved in setting up the scheme, getting backers from local government and educating people how to make programmes. The Engerwitzdorf scheme is an outgrowth of Telekom Austria's online TV channel Aon which lets people watch programmes on their PC. Aon streams a couple of live channels, plus sports, news and music programmes on to the net and has a pay-for-download section that lets people watch what they want when they want to watch it. In October a larger TV-on-demand project is due to launch in Vienna that will let people download many programmes from the net."
tfce2b61b8bd,Rich pickings for hi-tech thieves," Viruses, trojans and other malicious programs sent on to the net to catch you out are undergoing a subtle change.  The shift is happening as tech savvy criminals turn to technology to help them con people out of cash, steal valuable data or take over home PCs. Viruses written to make headlines by infecting millions are getting rarer. Instead programs are now crafted for directly criminal ends and firms are tightening up networks with defences to combat the new wave of malicious code.  The growing criminal use of malware has meant the end of the neat categorisation of different sorts of viruses and malicious programs. Before now it has been broadly possible to name and categorise viruses by the method they use to spread and how they infect machines. But many of the viruses written by criminals roll lots of technical tricks together into one nasty package.  ""You cannot put them in to the neat little box that you used to,"" said Pete Simpson, head of the threat laboratory at security firm Clearswift. Now viruses are just as likely to spread by themselves like worms, or to exploit loopholes in browsers or hide in e-mail message attachments. ""It's about outright criminality now,"" said Mr Simpson, explaining why this change has come about. He said many of the criminal programs came from Eastern Europe where cash-rich organised gangs can find a ready supply of technical experts that will crank out code to order. Former virus writer Marek Strihavka, aka Benny from the 29A virus writing group, recently quit the malware scene partly because it was being taken over by spyware writers, phishing gangs, and spammers who are more interested in money rather than the technology. No longer do virus writers produce programs to show off their technical prowess to rivals in the underground world of malware authors. Not least, said Paul King, principal security consultant at Cisco, because the defences against such attacks are so common. ""In many ways the least likely way to do it is e-mail because most of us have got anti-virus and firewalls now,"" he said. Few of the malicious programs written by hi-tech thieves are cleverly written, many are much more pragmatic and use tried and tested techniques to infect machines or to trick users into installing a program or handing over important data. ""If you think of criminals they do not do clever,"" said Mr King, ""they just do what works.""  As the tactics used by malicious programs change, said Mr King, so many firms were changing the way they defend themselves. Now many scan machines that connect to the corporate networks to ensure they have not been compromised while off the core network.  Many will not let a machine connect and a worker get on with their job before the latest patches and settings have been uploaded. As well as using different tactics, criminals also use technology for reasons that are much more transparent. ""The main motivation now is money,"" said Gary Stowell, spokesman for St Bernard software. Mr Stowell said organised crime gangs were turning to computer crime because the risks of being caught were low and the rates of return were very high. With almost any phishing or spyware attack, criminals are guaranteed to catch some people out and have the contacts to exploit what they recover. So-called spyware was proving very popular with criminals because it allowed them to take over machines for their own ends, to steal key data from users or to hijack web browsing sessions to point people at particular sites. In some cases spyware was being written that searched for rival malicious programs on PCs it infects and then trying to erase them so it has sole ownership of that machine."
tfc79e39b792,Apple iPod family expands market," Apple has expanded its iPod family with the release of its next generation of the digital music players.  Its latest challenges to the growing digital music gadget market include an iPod mini model which can hold 6GB compared to a previous 4GB. The company, which hopes to keep its dominant place in the digital music market, also said the gold coloured version of the mini would be dropped. A 30GB version has also been added to the iPod Photo family. The latest models have a longer battery life and their prices have been cut by an average of £40. The original iPod took an early lead in the digital music player market thanks to its large storage capacity and simple design.  During 2004 about 25 million portable players were sold, 10 million of which were Apple iPods. But analysts agree that the success is also down to its integration with the iTunes online store, which has given the company a 70% share of the legal download music market. Mike McGuire, a research director at analyst Gartner, told the BBC News website that Apple had done a good job in ""sealing off the market from competition"" so far. ""They have created a very seamless package which I think is the idea of the product - the design, function and the software are very impressive,"" he said. He added that the threat from others was always present, however. ""Creative, other Microsoft-partnered devices, Real, Sony and so on, are ratcheting up the marketing message and advertising,"" he said. Creative was very upbeat about how many of its Creative Zen players it had shipped by the end of last year, he said. Its second-generation models, like the Creative Zen Micro Photo, is due out in the summer. It will have 5GB of memory on board.  Digital music players are now the gadget of choice among young Americans, according to recent research by the Pew Internet and American Life Project. One in 10 US adults - 22 million people - now owns a digital music player of some sort. Sales of legally downloaded songs also rose more than tenfold in 2004, according to the record industry, with 200 million tracks bought online in the US and Europe in 12 months. The IFPI industry body said that the popularity of portable music players was behind the growth. Analysts say that the ease of use and growth of music services available on the net will continue to drive the trend towards portable music players.  People are also starting to use them in novel ways. Some are combining automatic syncing functions many of them have with other net functions to automatically distribute DIY radio shows, called podcasts. But 2005 will also see more competition from mobile phone operators who are keen to offer streaming services on much more powerful and sophisticated handsets. According to Mr McGuire, research suggests that people like the idea of building up huge libraries of music, which they can do with high-capacity storage devices, like iPods and Creative Zens. Mobiles do not yet have this capacity though, and there are issues about the ease of portability of mobile music. Mr McGuire said Apple was ensuring it kept a foot in the mobile music door with its recent deal with Motorola to produce a version of iTunes for Motorola phones."
tf1ca407d243,Iran jails blogger for 14 years," An Iranian weblogger has been jailed for 14 years on charges of spying and aiding foreign counter-revolutionaries.  Arash Sigarchi was arrested last month after using his blog to criticise the arrest of other online journalists. Mr Sigarchi, who also edits a newspaper in northern Iran, was sentenced by a revolutionary court in the Gilan area. His sentence, criticised by human rights watchdog Reporters Without Borders, comes a day after an online ""day of action"" to secure his release. Iranian authorities have recently clamped down on the growing popularity of weblogs, restricting access to major blogging sites from within Iran. A second Iranian blogger, Motjaba Saminejad, who also used his website to report on bloggers' arrests, is still being held.  A spokesman for Reporters Without Borders, which tracks press freedom across the globe, described Mr Sigarchi's sentence as ""harsh"" and called on Iranian President Mohammed Khatami to work to secure his immediate release. ""The authorities are trying to make an example of him,"" the organisation said in a statement.  ""By handing down this harsh sentence against a weblogger, their aim is to dissuade journalists and internet-users from expressing themselves online or contacting foreign media."" In the days before his arrest Mr Sigarchi gave interviews to the BBC Persian Service and the US-funded Radio Farda. Iranian authorities have arrested about 20 online journalists during the current crackdown. They accused Mr Sigarchi of a string of crimes against Iranian state, including espionage, insulting the founder of Iran's Islamic Republic, Ayatollah Ruhollah Khomenei, and current Supreme Leader Ayatollah Ali Khamenei. Mr Sigarchi's lawyer labelled the revolutionary court ""illegal and incompetent"" and called for a retrial in a public court.  Mr Sigarchi was sentenced one day after an online campaign highlighted his case in a day of action in defence of bloggers around the world.  The Committee to Protect Bloggers designated 22 February 2005 as Free Mojtaba and Arash Day. Around 10,000 people visited the campaign's website during the day. About 12% of users were based in Iran, the campaign's director told the BBC News website. Curt Hopkins said Mr Sigarchi's sentence would not dent the resolve of bloggers joining the campaign to help highlight the case. ""The eyes of 8 million bloggers are going to be more focused on Iran since Sigarchi's sentence, not less. ""The mullahs won't be able to make a move without it be spread across the blogosphere."""
tf1c44c2dda9,Yahoo moves into desktop search," Internet giant Yahoo has launched software to allow people to search e-mail and other files on their PCs.  The firm is following in the footsteps of Microsoft, Google and Ask Jeeves, which have offered similar services. Search has become a lucrative and hotly-contested area of expansion for net firms, looking to extend loyalty beyond the web. With hard drives providing bigger storage, users could need more help to locate important files, such as photos.  The desktop search technology has been licensed from a US-based firm X1 Technologies. It is designed to work alongside Microsoft's Outlook and Outlook Express e-mail programs. Searching e-mail effectively is becoming increasingly important, especially as the amount of spam increases. According to research from message analysts the Radicati Group, up to 45% of businesses' critical information is stored in e-mail and attachments. Yahoo's software can also work separately on the desktop, searching for music, photos and other files. Users can search under a variety of criteria, including file name, size, date and time. It doesn't yet incorporate web searching, although Yahoo has promised that future versions will allow users to search both web-based and desktop data. ""We are all getting more and more files on our desktop but the real commercial opportunity lies with linking this through to web content,"" said Julian Smith, an analyst with research firm Jupiter. ""It is all about extending the idea of search and getting a closer relationship with consumers by organising not just how they search on the internet but the files on your computer as well,"" he said. Search engines are often the first port of call for users when they go onto the web. The new foray into desktop search has rung alarm bells for human rights groups, concerned about the implications to privacy. And not everyone is impressed with the functionality of such services. Alexander Linden, vice president of emerging technologies at analyst firm Gartner,downloaded the Google product but has since removed it. ""It was just not very interesting,"" he said. He believes the rush to enter the desktop business is just a way of keeping up with rivals. ""Desktop search is just one of many features people would like but I'm suspicious of its usefulness,"" he said. More useful would be tools that can combine internet, intranet and desktop search alongside improvements to key word searching, he said."
